perfume,825905,,"Perfume (UK: , US: ; French: parfum) is a mixture of fragrant essential oils or aroma compounds, fixatives and solvents, used to give the human body, animals, food, objects, and living-spaces an agreeable scent

It is usually in liquid form and used to give a pleasant scent to a person's body

Ancient texts and archaeological excavations show the use of perfumes in some of the earliest human civilizations
 Modern perfumery began in the late 19th century with the commercial synthesis of aroma compounds such as vanillin or coumarin, which allowed for the composition of perfumes with smells previously unattainable solely from natural aromatics alone



== History ==

The word perfume derives from the Latin perfumare, meaning ""to smoke through""
"
flowers,133735,,"A flower, sometimes known as a bloom or blossom, is the reproductive structure found in flowering plants (plants of the division Magnoliophyta, also called angiosperms)
 The biological function of a flower is to affect reproduction, usually by providing a mechanism for the union of sperm with eggs
 Flowers may facilitate outcrossing (fusion of sperm and eggs from different individuals in a population) or allow selfing (fusion of sperm and egg from the same flower)
 Some flowers produce diaspores without fertilization (parthenocarpy)
 Flowers contain sporangia and are the site where gametophytes develop
"
bed,63771,,"A bed is a piece of furniture which is used as a place to sleep or relax
Most modern beds consist of a soft, cushioned mattress on a bed frame, the mattress resting either on a solid base, often wood slats, or a sprung base
 Many beds include a box spring inner-sprung base, which is a large mattress-sized box containing wood and springs that provide additional support and suspension for the mattress
 Beds are available in many sizes, ranging from infant-sized bassinets and cribs, to small beds for a single person or adult, to large queen and king-size beds designed for two people
 While most beds are single mattresses on a fixed frame, there are other varieties, such as the murphy bed, which folds into a wall, the sofa bed, which folds out of a sofa, and the bunk bed, which provides two mattresses on two tiers
 Temporary beds include the inflatable air mattress and the folding camp cot
"
mouse pad,593389,,"A mousepad is a surface for placing and moving a computer mouse
 A mousepad enhances the usability of the mouse compared to using a mouse directly on a table by providing a surface to allow it to measure movement accurately and without jitter
 Some mousepads increase ergonomics by providing a padded wrist rest



== History ==

During a 1968 presentation by Douglas Engelbart marking the public debut of a mouse, 
Engelbart used a control console designed by Jack Kelley of Herman Miller that included a keyboard and an inset portion used as a support area for the mouse

According to Kelley 
and also stated by Alex Pang, Kelley designed the first mousepad a year later, in 1969
"
watch,168585,,"A match is a tool for starting a fire
 Typically, matches are made of small wooden sticks or stiff paper
 One end is coated with a material that can be ignited by frictional heat generated by striking the match against a suitable surface
 Wooden matches are packaged in matchboxes, and paper matches are partially cut into rows and stapled into matchbooks
 The coated end of a match, known as the match ""head"", consists of a bead of active ingredients and  binder; often colored for easier inspection
"
chocolate,725791,,"Chocolate is a usually sweet, brown food preparation of roasted and ground cacao seeds that is made in the form of a liquid, paste, or in a block, or used as a flavoring ingredient in other foods
 The earliest evidence of use traces to the Olmecs (modern day Mexico), with evidence of chocolate beverages dating to 1900 BC
 The majority of Mesoamerican people made chocolate beverages, including the Maya and Aztecs
 The word ""chocolate"" is derived from the Classical Nahuatl word chocolātl
The seeds of the cacao tree have an intense bitter taste and must be fermented to develop the flavor
 After fermentation, the beans are dried, cleaned, and roasted
 The shell is removed to produce cacao nibs, which are then ground to cocoa mass, unadulterated chocolate in rough form
"
bucket,592893,,"A bucket is typically a watertight, vertical cylinder or truncated cone or square, with an open top and a flat bottom, attached to a semicircular carrying handle called the bail
A bucket is usually an open-top container
  In contrast, a pail can have a top or lid and is a shipping container
 In common usage, the two terms are often used interchangeably



== Types and uses ==
There are many types of buckets;

A water bucket is used to carry, water
Household and garden buckets are used for carrying liquids and granular products
Elaborate ceremonial or ritual buckets in bronze, ivory or other materials are found in several ancient or medieval cultures and are sometimes known by the Latin for bucket, situla
Large scoops or buckets are attached to loaders and telehandlers for agricultural and earth-moving purposes
Crusher buckets attached to excavators are used for crushing and recycling material in the Construction Industry
A lunch box is sometimes called a lunch pail, or a lunch bucket

Buckets can be re-purposed as seats, tool caddies, hydroponic gardens, chamber pots, ""street"" drums, or livestock feeders, or for long term food storage by survivalists
Buckets are often used as children's toys to shape and carry sand on a beach or in a sandpit
"
rusty nail,79532,,"A Rusty Nail is made by mixing Drambuie and Scotch whisky
 The drink was included in Difford's Guide's Top 100 Cocktails
A Rusty Nail can be served in an old-fashioned glass on the rocks, neat, or ""up"" in a stemmed glass
 It is most commonly served over ice
 A Rusty Nail served without ice is sometimes called a Straight Up Nail



== Variations ==
Versions of the drink can be made using any aged spirit, though blended Scotch whisky is traditional
Other variations include:

The Rusty Bob, which substitutes Bourbon whisky for blended Scotch whisky
The Rusty Ale, in which a shot of Drambuie is added to any beer, served without ice
"
blouse,474176,,"A blouse () is a loose-fitting upper garment that was formerly worn by workmen, peasants, artists, women, and children
  It is typically gathered at the waist or hips (by tight hem, pleats, parter, or belt) so that it hangs loosely (""blouses"") over the wearer's body
  Today, the word most commonly refers to a girl's or woman's dress shirt
 It can also refer to a man's shirt if it is a loose-fitting style (e
g
 poet shirts and Cossack shirts), though it rarely is
"
knife,296450,,"In humans and other primates, the knee joins the thigh with the leg and consists of two joints: one between the femur and tibia (tibiofemoral joint), and one between the femur and patella (patellofemoral joint)
 It is the largest joint in the human body
 The knee is a modified hinge joint, which permits flexion and extension as well as slight internal and external rotation
 The knee is vulnerable to injury and to the development of osteoarthritis

It is often termed a compound joint having tibiofemoral and patellofemoral components
"
sailboat,883423,,"A sailboat or sailing boat is a boat propelled partly or entirely by sails smaller than a sailing ship
 Distinctions in what constitutes a sailing boat and ship vary by region and maritime culture



== Types ==

Although sailboat terminology has varied across history, many terms have specific meanings in the context of modern yachting
 A great number of sailboat-types may be distinguished by size, hull configuration, keel type, purpose, number and configuration of masts, and sail plan

Popular monohull designs include:


=== Cutter ===

The cutter is similar to a sloop with a single mast and mainsail, but generally carries the mast further aft to allow for  a jib and staysail to be attached to the head stay and inner forestay, respectively
"
playing card,151258,,"A playing card is a piece of specially prepared card stock, heavy paper, thin cardboard, plastic-coated paper, cotton-paper blend, or thin plastic that is marked with distinguishing motifs
 Often the front (face) and back of each card has a finish to make handling easier
 They are most commonly used for playing card games, and are also used to perform magic tricks, for cardistry, in card throwing, and for building card houses
 Some types of cards such as tarot cards are also used for divination
 Playing cards are typically palm-sized for convenient handling, and usually are sold together in a set as a deck of cards or pack of cards
"
computer,244366,,"A computer is a machine that can be instructed to carry out sequences of arithmetic or logical operations automatically via computer programming
 Modern computers have the ability to follow generalized sets of operations, called programs
 These programs enable computers to perform an extremely wide range of tasks
 A ""complete"" computer including the hardware, the operating system (main software), and peripheral equipment required and used for ""full"" operation can be referred to as a computer system
 This term may as well be used for a group of computers that are connected and work together, in particular a computer network or computer cluster
"
paper,459642,,"Paper is a thin material produced by pressing together moist fibres of cellulose pulp derived from wood, rags or grasses, and drying them into flexible sheets

It is a versatile material with many uses, including writing, printing, packaging, cleaning, decorating, and a number of industrial and construction processes
 Papers are essential in legal or non-legal documentation

The pulp papermaking process developed in China during the early 2nd century CE, possibly as early as the year 105 CE, by the Han court eunuch Cai Lun, although the earliest archaeological fragments of paper derive from the 2nd century BCE in China

The modern pulp and paper industry is global, with China leading its production and the United States right behind it
"
USB drive,634963,,"A USB flash drive is a data storage device that includes flash memory with an integrated USB interface
 It is typically removable, rewritable and much smaller than an optical disc
 Most weigh less than 30 g (1 oz)
 Since first appearing on the market in late 2000, as with virtually all other computer memory devices, storage capacities have risen while prices have dropped
 As of March 2016, flash drives with anywhere from 8 to 256 GB were frequently sold, while 512 GB and 1 TB units were less frequent
"
brocolli,913126,,"Broccoli is an edible green plant in the cabbage family (family Brassicaceae, genus Brassica) whose large flowering head and stalk is eaten as a vegetable
 The word broccoli comes from the Italian plural of broccolo, which means ""the flowering crest of a cabbage"", and is the diminutive form of brocco, meaning ""small nail"" or ""sprout""
Broccoli is classified in the Italica cultivar group of the species Brassica oleracea
 Broccoli has large flower heads, usually dark green in color, arranged in a tree-like structure branching out from a thick stalk which is usually light green
 The mass of flower heads is surrounded by leaves
 Broccoli resembles cauliflower, which is a different cultivar group of the same Brassica species
"
door,365913,,"A door is a hinged or otherwise movable barrier that allows ingress and egress into an ""enclosure""
 The opening in the wall can be referred to as a ""portal""
 A door's essential and primary purpose is to provide security by controlling access to the portal (doorway)
 Conventionally, it is a panel that fits into the portal of a building, room, or vehicle
 Doors are commonly made of a material suited to the task of which it is to perform
"
packing peanuts,959313,,"Foam peanuts, also known as foam popcorn, packing peanuts  or packing noodles, are a common loose-fill packaging and cushioning material used to prevent damage to fragile objects during shipping
 They are shaped to interlock when compressed and free flow when not compressed
 They are roughly the size and shape of an unshelled peanut and commonly made of expanded polystyrene foam
 50–75 millimetres (2-3 in) of peanuts are typically used for cushioning and void filling packaging applications
 The original patent was filed for by Robert E
 Holden in 1962 and was granted in 1965
"
key chain,726710,,"A keychain, or keyring, is a small chain, usually made from metal or plastic, that connects a small item to a keyring
 The length of a keychain allows an item to be used more easily than if connected directly to a keyring
 Some keychains allow one or both ends the ability to rotate, keeping the keychain from becoming twisted, while the item is being used

A keychain can also be a connecting link between a keyring and the belt of an individual
 It is usually employed by personnel whose job demands frequent use of keys, such as a security guard, prison officer, janitor, or retail store manager
"
candy wrapper,657778,,"Candy, also called sweets (British English) or lollies (Australian English, New Zealand English), is a confection that features sugar as a principal ingredient
  The category, called sugar confectionery, encompasses any sweet confection, including chocolate, chewing gum, and sugar candy
 Vegetables, fruit, or nuts which have been glazed and coated with sugar are said to be candied

Physically, candy is characterized by the use of a significant amount of sugar or sugar substitutes
  Unlike a cake or loaf of bread that would be shared among many people, candies are usually made in smaller pieces
"
lace,670352,,"Lace is a delicate fabric made of yarn or thread in an open weblike pattern, made by machine or by hand

Originally linen, silk, gold, or silver threads were used
 Now lace is often made with cotton thread, although linen and silk threads are still available
 Manufactured lace may be made of synthetic fiber
 A few modern artists make lace with a fine copper or silver wire instead of thread
"
stockings,190254,,"Stockings (also known as hose, especially in a historical context) are close-fitting, variously elastic garments covering the leg from the foot up to the knee or possibly part or all of the thigh
 Stockings vary in color, design, and transparency
 Today, stockings are primarily worn for fashion and aesthetics, usually in association with mid-length or short skirts



== History ==

Historically, even though the word sock is at least as ancient in origin, what men normally wore were often referred to as stockings, probably especially when referring to longer hose
 The word stock used to refer to the bottom ""stump"" part of the body, and by analogy the word was used to refer to the one-piece covering of the lower trunk and limbs of the 15th century—essentially tights consisting of the upper-stocks (later to be worn separately as knee breeches) and nether-stocks (later to be worn separately as stockings)
"
bottle,46241,,"A bottle is a narrow-necked container made of an impermeable material (clay, glass, plastic, aluminium etc
) in various shapes and sizes  to store and transport liquids (water, milk, beer, wine, ink, cooking oil, medicine, soft drinks, shampoo, and chemicals, etc
) and whose mouth at the bottling line can be sealed with an internal stopper, an external bottle cap, a closure, or a conductive ""inner seal"" using induction sealing

Some of the earliest bottles appeared in China, Phoenicia, Crete, and Rome



== Etymology ==

First attested in 14th century
 From the English word bottle derives from an Old French word boteille, from vulgar Latin butticula, from late Latin buttis (""cask""), a latinisation of the Greek βοῦττις (bouttis) (""vessel"")



== Types of bottle ==


=== Glass bottles ===


==== Wine bottles ====

The glass bottle represented an important development in the history of wine, because, when combined with a high-quality stopper such as a cork, it allowed long-term aging of wine
"
newspaper,390182,,"A newspaper is a periodical publication containing written information about current events and is often typed in black ink with a white or gray background

Newspapers can cover a wide variety of fields such as politics, business, sports and art, and often include materials such as opinion columns, weather forecasts, reviews of local services, obituaries, birth notices, crosswords, editorial cartoons, comic strips, and advice columns

Most newspapers are businesses, and they pay their expenses with a mixture of subscription revenue, newsstand sales, and advertising revenue
 The journalism organizations that publish newspapers are themselves often metonymically called newspapers

Newspapers have traditionally been published in print (usually on cheap, low-grade paper called newsprint)
"
wallet,978579,,"Ballet (French: [balɛ]) is a type of performance dance that originated during the Italian Renaissance in the fifteenth century and later developed into a concert dance form in France and Russia
 It has since become a widespread, highly technical form of dance with its own vocabulary based on French terminology
 It has been globally influential and has defined the foundational techniques used in many other dance genres and cultures
 Ballet has been taught in various schools around the world, which have historically incorporated their own cultures and as a result, the art has evolved in a number of distinct ways
 See glossary of ballet
"
clay pot,775602,,"Pottery is the process of forming vessels and other objects with clay and other ceramic materials, which are fired at high temperatures to give them a hard, durable form
   Major types include earthenware, stoneware and porcelain
 The place where such wares are made by a potter is also called a pottery (plural ""potteries"")
  The definition of pottery used by the American Society for Testing and Materials (ASTM), is ""all fired ceramic wares that contain clay when formed, except technical, structural, and refractory products
"" In archaeology, especially of ancient and prehistoric periods, ""pottery"" often means vessels only, and figures etc
 of the same material are called ""terracottas""
"
apple,111625,,"In mathematics and computer science, apply is a function that applies functions to arguments
 It is central to programming languages derived from lambda calculus, such as LISP and Scheme, and also in functional languages
 It has a role in the study of the denotational semantics of computer programs, because it is a continuous function on complete partial orders
 Apply is also a continuous function in homotopy theory, and, indeed underpins the entire theory: it allows a homotopy deformation to be viewed as a continuous path in the space of functions
  Likewise, valid mutations (refactorings) of computer programs can be seen as those that are ""continuous"" in the Scott topology
"
vase,566378,,"A vase (, , or ) is an open container
 It can be made from a number of materials, such as ceramics, glass, non-rusting metals, such as aluminium, brass, bronze, or stainless steel
 Even wood has been used to make vases, either by using tree species that naturally resist rot, such as teak, or by applying a protective coating to conventional wood
 Vases are often decorated, and they are often used to hold cut flowers
 Vases come in different sizes to support whatever flower its holding or keeping in place
"
deodorant,976150,,"A deodorant is a substance applied to the body to prevent or mask (hide) body odor due to bacterial breakdown of perspiration in the armpits, groin, and feet, and in some cases vaginal secretions
 A subclass of deodorants, called antiperspirants, prevents sweating itself, typically by blocking sweat glands
 Antiperspirants are used on a wider range of body parts, at any place where sweat would be inconvenient or unsafe, since unwanted sweating can interfere with comfort, vision, and grip (due to slipping)
 Other types of deodorant allow sweating but prevent bacterial action on sweat, since human sweat only has a noticeable smell when it is decomposed by bacteria

In the United States, the Food and Drug Administration classifies and regulates most deodorants as cosmetics but classifies antiperspirants as over-the-counter drugs
The first commercial deodorant, Mum, was introduced and patented in the late nineteenth century by an inventor in Philadelphia, Pennsylvania, Edna Murphey
"
bowl,915263,,"A bowl is a round dish or container typically used to prepare and serve food
 The interior of a bowl is characteristically shaped like a spherical cap, with the edges and the bottom forming a seamless curve
 This makes bowls especially suited for holding liquids and loose food, as the contents of the bowl are naturally concentrated in its center by the force of gravity
 The exterior of a bowl is most often round but can be of any shape, including rectangular

The size of bowls varies from small bowls used to hold a single serving of food to large bowls, such as punch bowls or salad bowl, that are often used to hold or store more than one portion of food
"
clock,653025,,"A clock is an instrument used to measure, keep, and indicate time
 The clock is one of the oldest human inventions, meeting the need to measure intervals of time shorter than the natural units: the day, the lunar month, and the year
 Devices operating on several physical processes have been used over the millennia

Some predecessors to the modern clock may be considered as ""clocks"" that are based on movement in nature: A sundial shows the time by displaying the position of a shadow on a flat surface
 There is a range of duration timers, a well-known example being the hourglass
"
toothbrush,112237,,"A toothbrush is an oral hygiene instrument used to clean the teeth, gums, and tongue
 It consists of a head of tightly clustered bristles, atop of which toothpaste can be applied, mounted on a handle which facilitates the cleaning of hard-to-reach areas of the mouth
 They are usually used alongside floss

They are available with different bristle textures, sizes, and forms
 Most dentists recommend using a soft toothbrush since hard-bristled toothbrushes can damage tooth enamel and irritate the gums
Because many common and effective ingredients in toothpaste are harmful if swallowed in large doses and instead should be spat out, the act of brushing teeth is most often done at a sink within the kitchen or bathroom, where the brush may be rinsed off afterwards to remove any debris remaining and then dried to reduce conditions ideal for germ growth (and, if it is a wooden toothbrush, mold as well)
"
magnet,113883,,"A magnet is a material or object that produces a magnetic field
 This magnetic field is invisible but is responsible for the most notable property of a magnet: a force that pulls on other ferromagnetic materials, such as iron, and attracts or repels other magnets
 
A permanent magnet is an object made from a material that is magnetized and creates its own persistent magnetic field
 An everyday example is a refrigerator magnet used to hold notes on a refrigerator door
 Materials that can be magnetized, which are also the ones that are strongly attracted to a magnet, are called ferromagnetic (or ferrimagnetic)
"
cat,75713,,"The cat (Felis catus) is a small carnivorous mammal
 It is the only domesticated species in the family Felidae and often referred to as the domestic cat to distinguish it from wild members of the family
 The cat is either a house cat, a farm cat or a feral cat; latter ranges freely and avoids human contact

Domestic cats are valued by humans for companionship and for their ability to hunt rodents
 About 60 cat breeds are recognized by various cat registries
The cat is similar in anatomy to the other felid species, has a strong flexible body, quick reflexes, sharp teeth and retractable claws adapted to killing small prey
"
cell phone,277271,,"A mobile phone, cellular phone, cell phone, cellphone, or hand phone, sometimes shortened to simply mobile, cell or just phone, is a portable telephone that can make and receive calls over a radio frequency link while the user is moving within a telephone service area
 The radio frequency link establishes a connection to the switching systems of a mobile phone operator, which provides access to the public switched telephone network (PSTN)
 Modern mobile telephone services use a cellular network architecture, and, therefore, mobile telephones are called cellular telephones or cell phones, in North America
 In addition to telephony, 2000s-era mobile phones support a variety of other services, such as text messaging, MMS, email, Internet access, short-range wireless communications (infrared, Bluetooth), business applications, video games, and digital photography
 Mobile phones offering only those capabilities are known as feature phones; mobile phones which offer greatly advanced computing capabilities are referred to as smartphones
"
cinder block,691293,,"A concrete masonry unit (CMU) is a standard size rectangular block used in building construction
 CMUs are some of the most versatile building products available because of the wide variety of appearances that can be achieved using concrete masonry units
Those that use cinders (fly ash or bottom ash) are called cinder blocks in the United States, breeze blocks (breeze is a synonym of ash) in the United Kingdom, and hollow blocks in the Philippines
 In New Zealand and Canada they are known as concrete blocks (a name common in the United States also)
 In New Zealand, they are also called construction blocks
 In Australia they are also called Besser blocks and Besser bricks, because the Besser Company was a major supplier of machines that made concrete blocks
"
