rubber duck,532707,,"A rubber duck (also known as a rubber ducky) is a toy shaped like a stylized duck, generally yellow with a flat base
 It may be made of rubber or rubber-like material such as vinyl plastic
 The yellow rubber duck has achieved an iconic status in Western pop culture and is often symbolically linked to bathing



== History ==

The history of the rubber duck is linked to the emergence of rubber manufacturing in the late 19th century
 The earliest rubber ducks were made from harder rubber when manufacturers began using Charles Goodyear's invention, vulcanized rubber
"
rubber duck,532707,,"A rubber duck (also known as a rubber ducky) is a toy shaped like a stylized duck, generally yellow with a flat base
 It may be made of rubber or rubber-like material such as vinyl plastic
 The yellow rubber duck has achieved an iconic status in Western pop culture and is often symbolically linked to bathing



== History ==

The history of the rubber duck is linked to the emergence of rubber manufacturing in the late 19th century
 The earliest rubber ducks were made from harder rubber when manufacturers began using Charles Goodyear's invention, vulcanized rubber
"
mp3 player,158193,,"An MP3 player is an electronic device that can play MP3 digital audio files
 It is a type of digital audio player, or portable media player
 Most players play more than the MP3 file format, such as Windows Media Audio (WMA), Advanced Audio Coding (AAC), Vorbis, FLAC, Speex and Ogg



== History ==


=== Digital audio player ===

In 1981, Kane Kramer filed for a UK patent for the IXI, the first Digital Audio Player
 UK patent 2115996 was issued in 1985, and U
S
 Patent 4,667,088 was issued in 1987
"
pencil,803716,,"A pencil is an implement for writing or drawing, constructed of a narrow, solid pigment core in a protective casing that prevents the core from being broken and/or marking the user's hand

Pencils create marks by physical abrasion, leaving a trail of solid core material that adheres to a sheet of paper or other surface
 They are distinct from pens, which dispense liquid or gel ink onto the marked surface

Most pencil cores are made of graphite powder mixed with a clay binder
 Graphite pencils (traditionally known as 'lead pencils') produce grey or black marks that are easily erased, but otherwise resistant to moisture, most chemicals, ultraviolet radiation and natural aging
"
mirror,904326,,"A mirror is an object that reflects light in such a way that, for incident light in some range of wavelengths; the reflected light preserves many or most of the detailed physical characteristics of the original light, called specular reflection
 This is different from other light-reflecting objects that do not preserve much of the original wave signal other than color and diffuse reflected light, such as flat-white paint

The most familiar type of mirror is the plane mirror, which has a flat surface
 Curved mirrors are also used, to produce magnified or diminished images or focus light or simply distort the reflected image

Mirrors are commonly used for personal grooming, viewing oneself (where they are also called looking-glasses), viewing the area behind and on the sides on motor vehicles while driving, for decoration, and architecture
"
flag,446154,,"A flag is a piece of fabric (most often rectangular or quadrilateral) with a distinctive design and colours
 It is used as a symbol, a signalling device, or for decoration
 The term flag is also used to refer to the graphic design employed, and flags have evolved into a general tool for rudimentary signalling and identification, especially in environments where communication is challenging (such as the maritime environment, where semaphore is used)
 The study of flags is known as ""vexillology"" from the Latin vexillum, meaning ""flag""

National flags are patriotic symbols with widely varied interpretations that often include strong military associations because of their original and ongoing use for that purpose
"
couch,519744,,"A couch (U.S. English, Australian English and South African English), also known as a sofa,  futon, chesterfield (Canadian English), or settee/sofa or couch (British English, Irish English and New Zealand English) is a piece of furniture for seating two or three people in the form of a bench, with armrests, which is partially or entirely upholstered, and often fitted with springs and tailored cushions
 Although a couch is used primarily for seating, it may be used for sleeping
 In homes, couches are normally found in the family room, living room, den, or the lounge
 They are sometimes also found in non-residential settings such as hotels, lobbies of commercial offices, waiting rooms, and bars



== History of the term ==
The term couch is predominantly used in Ireland, North America, South Africa, Australia and the United Kingdom, although, the terms sofa and settee (U and non-U) are sometimes used in the United Kingdom
"
soap,259257,,"SOAP (abbreviation for Simple Object Access Protocol) is a messaging protocol specification for exchanging structured information in the implementation of web services in computer networks
 Its purpose is to provide extensibility, neutrality and independence
 It uses XML Information Set for its message format, and relies on application layer protocols, most often Hypertext Transfer Protocol (HTTP), although some legacy systems communicate over Simple Mail Transfer Protocol (SMTP), for message negotiation and transmission

SOAP allows developers to invoke processes running on disparate operating systems (such as Windows, macOS, and Linux) to authenticate, authorize, and communicate using Extensible Markup Language (XML)
 Since Web protocols like HTTP are installed and running on all operating systems, SOAP allows clients to invoke web services and receive responses independent of language and platforms
"
twezzers,820874,,"Twelver (Arabic: ٱثْنَا عَشَرِيَّة‎; ʾIthnā ʿAšarīyah Persian: شیعه دوازده‌امامی‎, Šī'eh-ye Davâzdah-Emâmī), also known as Imamiyyah (Arabic: إِمَامِيَّة‎), is the largest branch of Shia Islam
 The term Twelver refers to its adherents' belief in twelve divinely ordained leaders, known as the Twelve Imams, and their belief that the last Imam, Imam al-Mahdi, lives in occultation and will reappear as the promised Mahdi
 According to Shia tradition, the Mahdi's tenure will coincide with the Second Coming of Jesus, who is to assist the Mahdi against the Dajjal

Twelvers believe that the Twelve Imams are the spiritual and political successors to the Islamic prophet Muhammad
 According to the theology of Twelvers, the Twelve Imams are exemplary human individuals who not only rule over the community with justice, but are also able to preserve and interpret sharia and the esoteric meaning of the Quran
"
towel,938335,,"A towel is a piece of absorbent fabric or paper used for drying or wiping a body or a surface
 It draws moisture through direct contact, often using a blotting or a rubbing motion

In households, several types of fabric towels are used, including hand towels, bath towels and kitchen towels
 In warm climates, people may also use beach towels

Paper towels are provided in commercial or office bathrooms for users to dry their hands
"
face wash,5380,,"Girl, Wash Your Face: Stop Believing the Lies About Who You Are So You Can Become Who You Were Meant to Be is a best-selling 2018 self-help book by Rachel Hollis
Girl, Wash Your Face is described by The Washington Post as mixing ""memoir, motivational tips, Bible quotations and common-sense girl talk
"" The prevailing message of her tome is one largely of female self-reliance, best summed up by Hollis in the book as ""You, and only you, are ultimately responsible for how happy you are
"" The book has been wildly successful, described as a ""publishing phenomenon"" and was the second-most popular book of 2018 on Amazon
com
 Girl, Wash Your Face is listed as a New York Times best-seller under the Advice, How-To, & Miscellaneous category
The book is composed of 20 chapters centered on 20 lies Hollis said she formerly told herself—e
g
 ""I'll start tomorrow"" and ""I am defined by my weight""—and she goes on to explain how she successfully tackled each obstacle



== Reception ==
The Gospel Coalition's Alisa Childers said Hollis can ""tell a story that will have you crying one minute and shooting Diet Coke out of your nose the next"" but ultimately was conflicted with the overall book
 While Childers was sympathetic to many of the themes contained in the book, she felt that despite being marketed as a Christian book, its core message of lifting oneself up by their bootstraps as the solution to any problem came in lieu of ""surrendering your life to Jesus and placing your trust in him alone
"" She also acknowledged that the book ""exhausted"" her
"
nail file,211791,,"A nail file is a tool used to gently grind down and shape the edges of nails
 They are often used in manicures and pedicures after the nail has been trimmed using appropriate nail clippers
  Nail files may either be emery boards, ceramic, glass, crystal, plain metal files or metal files coated with corundum

A nail drill is a powered rotary tool, which is used by a nail technician to file nails



== Materials ==


=== Emery board ===

Emery boards are small flat long objects which have emery or emery paper glued to them, making them both abrasive and flexible, used for fingernail and toenail care
"
white out,683480,,"Wite-Out is a registered trademark for a brand of correction fluid, originally created for use with photocopies, and manufactured by the BIC corporation



== History ==
Wite-Out dates to 1966, when Edwin Johanknecht, an insurance-company clerk, sought to address a problem he observed in correction fluid available at the time: a tendency to smudge ink on  photostatic copies when it was applied
 Johanknecht enlisted the help of his associate George Kloosterhouse, a basement waterproofer who experimented with chemicals, and together they developed their own correction fluid, introduced as ""Wite-Out WO-1 Erasing Liquid""

In 1971, they incorporated as Wite-Out Products, Inc
 The trademark ""Wite-Out"" was registered by the United States Patent and Trademark Office on February 5, 1974
"
piano,384535,,"The piano is an acoustic, stringed musical instrument invented in Italy by Bartolomeo Cristofori around the year 1700 (the exact year is uncertain), in which the strings are struck by hammers
 It is played using a keyboard, which is a row of keys (small levers) that the performer presses down or strikes with the fingers and thumbs of both hands to cause the hammers to strike the strings

The word piano is a shortened form of pianoforte, the Italian term for the early 1700s versions of the instrument,  which in turn derives from gravicembalo col piano e forte and fortepiano
 The Italian musical terms piano and forte indicate ""soft"" and ""loud"" respectively, in this context referring to the variations in volume (i
e
, loudness) produced in response to a pianist's touch or pressure on the keys: the greater the velocity of a key press, the greater the force of the hammer hitting the strings, and the louder the sound of the note produced and the stronger the attack
 The name was created as a contrast to harpsichord, a musical instrument that does not allow variation in volume; compared to the harpsichord, the first fortepianos in the 1700s had a quieter sound and smaller dynamic range
An acoustic piano usually has a protective wooden case surrounding the soundboard and metal strings, which are strung under great tension on a heavy metal frame
"
Sewing needle,523494,,"A sewing needle, used for hand-sewing, is a long slender tool with a pointed tip at one end and a hole (or eye) at the other
 The earliest needles were made of bone or wood; modern needles are manufactured from high carbon steel wire and are nickel- or 18K gold-plated for corrosion resistance
 High quality embroidery needles are plated with two-thirds platinum and one-third titanium alloy
 Traditionally, needles have been kept in needle books or needlecases which have become objects of adornment
 Sewing needles may also be kept in an étui, a small box that held needles and other items such as scissors, pencils and tweezers
"
rubber band,97672,,"A rubber band (also known as an elastic band, gum band or lacky band) is a loop of rubber, usually ring shaped, and commonly used to hold multiple objects together
 The rubber band was patented in England on March 17, 1845 by Stephen Perry
 Most rubber bands are manufactured out of natural rubber or, especially at larger sizes, elastomer, and are sold in a variety of sizes



== Manufacturing ==
Rubber bands are made by extruding the rubber into a long tube to provide its general shape, putting the tubes on mandrels, curing the rubber with heat, and then slicing it across the width of the tube into little bands
 This causes the tube to split into multiple sections, creating a rubber band
"
ipad,720184,,"iPad ( EYE-pad) is a line of tablet computers designed, developed and marketed by Apple Inc
, which run the iOS and iPadOS  mobile operating systems
  The first iPad was released on April 3, 2010; the most recent iPad models are the seventh-generation iPad, released on September 25, 2019; the fifth-generation iPad mini, released on March 18, 2019; the third-generation iPad Air, released on March 18, 2019; and the 11-inch (280 mm) and third-generation 12
9-inch (330 mm) iPad Pro, released on November 7, 2018

As of May 2017, Apple has sold more than 360 million iPads, though sales peaked in 2013
 It is the most popular tablet computer by sales as of the second quarter of 2018
The user interface is built around the device's multi-touch screen, including a virtual keyboard
 All iPads can connect using Wi-Fi; some models also have cellular connectivity
"
shawl,478233,,"A shawl (from Persian: lang-Urdu شال‎ shāl, which may be from Hindi: दुशाला duśālā, ultimately from Sanskrit: शाटी śāṭī) is a simple item of clothing, loosely worn over the shoulders, upper body and arms, and sometimes also over the head
 It is usually a rectangular or square piece of cloth, which is often folded to make a triangle, but can also be triangular in shape
 Other shapes include oblong shawls



== History ==
The words ""shawl"" and ""pashmina"" come from Kashmir, but originate from Hamedan, Iran
 Sources report cashmere crafts were introduced by Sayeed Ali Hamadani, when the 14th century came to Ladakh, homeland of pashmina goats, where, for the first time in history, he found that the Ladakhi Kashmiri goats produced soft wool
"
eye liner,134531,,"Eye liner or eyeliner is a cosmetic used to define the eyes
 It is applied around the contours of the eye(s) to create a variety of aesthetic effects



== History ==

Eye liner was first used in Ancient Egypt and Mesopotamia as a dark black line around the eyes
 As early as 10,000 BC, Egyptians and Mesopotamians wore various cosmetics including eye liner not only for aesthetics but to protect the skin from the desert sun
  Research has also speculated that eye liner was worn to protect the wearer from the evil eye
"
tooth picks,827218,,"A toothpick is a small thin stick of wood, plastic, bamboo, metal, bone or other substance with at least one and sometimes two sharp ends to insert between teeth to remove detritus, usually after a meal
  Toothpicks are also used for festive occasions to hold or spear small appetizers (like cheese cubes or olives) or as a cocktail stick, and can be decorated with plastic frills or small paper umbrellas or flags



== History ==
Known in all cultures, the toothpick is not just the oldest instrument for dental cleaning, but predates the arrival of early modern humans, for the skulls of Neanderthals, as well as Homo sapiens, show clear signs of teeth picked with a tool
 Toothpicks made of bronze have been found as burial objects in prehistoric graves in Northern Italy and in the East Alps
 In 1986, researchers in Florida discovered the 7500-year-old remains of ancient Native Americans and discovered small grooves between many of the molar teeth
"
credit card,441631,,"A credit card is a payment card issued to users (cardholders) to enable the cardholder to pay a merchant for goods and services based on the cardholder's promise to the card issuer to pay them for the amounts plus the other agreed charges
 The card issuer (usually a bank) creates a revolving account and grants a line of credit to the cardholder, from which the cardholder can borrow money for payment to a merchant or as a cash advance

A credit card is different from a charge card, which requires the balance to be repaid in full each month
 In contrast, credit cards allow the consumers to build a continuing balance of debt, subject to interest being charged
 A credit card also differs from a cash card, which can be used like currency by the owner of the card
"
paint brush,160397,,"A paintbrush is a brush used to apply paint or sometimes ink
 A paintbrush is usually made by clamping the bristles to a handle with a ferrule
 They are available in various sizes, shapes, and materials
 Thicker ones are used for filling in, and thinner ones are used for details
 They may be subdivided into decorators' brushes used for painting and decorating and artists' brushes use for visual art
"
pillow,341568,,"A pillow is a support of the body at rest for comfort, therapy, or decoration
 Pillows are used by many species, including humans
 Some types of pillows include throw pillows, body pillows, decorative pillows and many more
 Pillows that aid sleeping are a form of bedding that supports the head and neck
 Other types of pillows are designed to support the body when lying down or sitting
"
sticky note,829517,,"A Post-it Note (or sticky note) is a small piece of paper with a re-adherable strip of glue on its back, made for temporarily attaching notes to documents and other surfaces
 A low-tack pressure-sensitive adhesive allows the notes to be easily attached, removed and even re-posted elsewhere without leaving residue
 Originally small yellow squares, Post-it Notes and related products are available in various colors, shapes, sizes and adhesive strengths
 As of 2019, there are at least 26 documented colors of Post-it Notes
Although 3M's patent expired in 1997, ""Post-it"" and the original notes' distinctive yellow color remain registered company trademarks, with terms such as ""repositionable notes"" used for similar offerings manufactured by competitors
 While use of the trademark 'Post-it' in a representative sense refers to any sticky note, no legal authority has ever held the trademark to be generic
"
ear phones,965712,,"Apple Inc
 has produced and sold numerous in-ear headphones since 2001, available for standalone purchase and bundled with iPhone and iPod products
 Apple's current product line consists of EarPods, wired earbuds available with a 3.5mm headphone or Lightning connector, and AirPods and AirPods Pro, wireless Bluetooth earbuds



== Bundled earbuds ==


=== Classic round design earbuds ===

Apple's original earbuds shipped with the original iPod, released on October 23, 2001
 They were never given a formal name and were referred to variously as ""iPod headphones"" and ""the iPod's earbud-style headphones""
"
bananas,723815,,"A banana is an edible fruit – botanically a berry – produced by several kinds of large herbaceous flowering plants in the genus Musa
 In some countries, bananas used for cooking may be called ""plantains"", distinguishing them from dessert bananas
 The fruit is variable in size, color, and firmness, but is usually elongated and curved, with soft flesh rich in starch covered with a rind, which may be green, yellow, red, purple, or brown when ripe
 The fruits grow in clusters hanging from the top of the plant
 Almost all modern edible seedless (parthenocarp) bananas come from two wild species – Musa acuminata and Musa balbisiana
"
air conditioner,833690,,"Air conditioning (often referred to as AC, A/C,) is the process of removing heat and moisture from the interior of an occupied space to improve the comfort of occupants
 Air conditioning can be used in both domestic and commercial environments
 This process is most commonly used to achieve a more comfortable interior environment, typically for humans and other animals; however, air conditioning is also used to cool and dehumidify rooms filled with heat-producing electronic devices, such as computer servers, power amplifiers, and to display and store some delicate products, such as artwork

Air conditioners often use a fan to distribute the conditioned air to an occupied space such as a building or a car to improve thermal comfort and indoor air quality
 Electric refrigerant-based AC units range from small units that can cool a small bedroom, which can be carried by a single adult, to massive units installed on the roof of office towers that can cool an entire building
"
scotch tape,853188,,"Scotch Tape is a brand name used for pressure-sensitive tapes manufactured by 3M as part of the company's Scotch brand
 Their magnetic recording tape products were also sold under the Scotch brand



== History ==
The precursor to the current tapes was developed in the 1930s in St
 Paul, Minnesota by Richard Drew to seal a then-new transparent material known as cellophane



== Trade names ==

Although it is a trademark and a brand name, Scotch tape is sometimes used  as a generic term
"
chalk,480480,,"Chalk is a soft, white, porous, sedimentary carbonate rock, a form of limestone composed of the mineral calcite
 Calcite is an ionic salt called calcium carbonate or CaCO3
 It forms under reasonably deep marine conditions from the gradual accumulation of minute calcite shells (coccoliths) shed from micro-organisms called coccolithophores
 Flint (a type of chert) is very common as bands parallel to the bedding or as nodules embedded in chalk
 It is probably derived from sponge spicules or other siliceous organisms as water is expelled upwards during compaction
"
sketch pad,800881,,"Crashbox is a Canadian-American educational children's television show that airs on the HBO Family digital cable television channel in the United States and Asia and ran from 1999 to 2000
 It aims to educate grade-school children in history, math, vocabulary, and other various subjects

Crashbox was one of the cornerstone programs for the relaunch of the HBO Family channel in February 1999
 The series has never been released on DVD or VHS, but reruns air on HBO Family to this day



== Creation team ==
Crashbox was created by Planet Grande Pictures (consisting of Eamon Harrington and John Watkin) and is animated by Cuppa Coffee Studios, headed by Adam Shaheen
"
leg warmers,50202,,"Leg warmers are coverings for the lower legs, similar to socks but thicker and generally footless
 Leg warmers are worn to keep the lower legs warm in colder weather
 They can be tubular sleeves, long fabric wrappings, or simple pieces of fur or fabric tied around the calves
 They are used in several outdoor activities and sports including cycling, soccer, hockey, hiking, ice skating, and dance

They are used as dancewear by ballet and other classic dancers in order to keep the leg muscles warm and to prevent cramping or other muscle injuries
"
sun glasses,945660,,"Sunglasses or sun glasses (informally called shades) are a form of protective eyewear designed primarily to prevent bright sunlight and high-energy visible light from damaging or discomforting the eyes
 They can sometimes also function as a visual aid, as variously termed spectacles or glasses exist, featuring lenses that are colored, polarized or darkened
 In the early 20th century, they were also known as sun cheaters (cheaters then being an American slang term for glasses)
The American Optometric Association recommends wearing sunglasses that block ultraviolet radiation (UV) whenever a person is in the sunlight to protect the eyes from  UV and blue light, which can cause several serious eye problems
 Its usage is mandatory immediately after some surgical procedures, such as LASIK, and recommended for a certain time period in dusty areas, when leaving the house and in front of a TV screen or computer monitor after LASEK
 It is important to note that dark glasses that do not block UV radiation can be more damaging to the eyes than not wearing eye protection at all, since they tend to open the pupil and allow more UV rays into the eye
 Since the 1940s, sunglasses have been a popular fashion accessory, especially on the beach
"
clothes,785296,,"Clothing (also known as clothes, apparel and attire) is items worn on the body
 Clothing is typically made of fabrics or textiles but over time has included garments made from animal skin or other thin sheets of materials put together
 The wearing of clothing is mostly restricted to human beings and is a feature of all human societies
 The amount and type of clothing worn depends on gender, body type, social, and geographic considerations

Clothing serves many purposes: it can serve as protection from the elements, rough surfaces, rash-causing plants, insect bites, splinters, thorns and prickles by providing a barrier between the skin and the environment
"
