sharpie,861588,,"Sharpie is a brand of writing instruments (mainly permanent marker pens) manufactured by Newell Brands, a public company, headquartered in Atlanta, Georgia
 Originally designating a single permanent marker, the Sharpie brand has been widely expanded and can now be found on a variety of previously unrelated permanent and non-permanent pens and markers formerly marketed under other brands
 This article focuses on the legacy Sharpie permanent marker line

Sharpie markers are made with several tips
 The most common and popular is the Fine tip
"
plastic fork,209535,,"In cutlery or kitchenware, a fork (from the Latin furca (""pitchfork"")) is a utensil, now usually made of metal, whose long handle terminates in a head that branches into several narrow and often slightly curved tines with which one can spear foods either to hold them to cut with a knife or to lift them to the mouth
  


== History ==

Bone forks have been found in archaeological sites of the Bronze Age Qijia culture (2400–1900 BC), the Shang dynasty (c
 1600–c
 1050 BC), as well as later Chinese dynasties
 A stone carving from an Eastern Han tomb (in Ta-kua-liang, Suide County, Shaanxi) depicts three hanging two-pronged forks in a dining scene
"
thermometer,218427,,"A thermometer is a device that measures temperature or a temperature gradient
 A thermometer has two important elements: (1) a temperature sensor (e
g
 the bulb of a mercury-in-glass thermometer or the pyrometric sensor in an infrared thermometer) in which some change occurs with a change in temperature; and (2) some means of converting this change into a numerical value (e
g
 the visible scale that is marked on a mercury-in-glass thermometer or the digital readout on an infrared model)
 Thermometers are widely used in technology and industry to monitor processes, in meteorology, in medicine, and in scientific research
"
candle,511536,,"Candy, also called sweets (British English) or lollies (Australian English, New Zealand English), is a confection that features sugar as a principal ingredient
  The category, called sugar confectionery, encompasses any sweet confection, including chocolate, chewing gum, and sugar candy
 Vegetables, fruit, or nuts which have been glazed and coated with sugar are said to be candied

Physically, candy is characterized by the use of a significant amount of sugar or sugar substitutes
  Unlike a cake or loaf of bread that would be shared among many people, candies are usually made in smaller pieces
"
checkbook,320509,,"A cheque, or check (American English; see spelling differences), is a document that orders a bank to pay a specific amount of money from a person's account to the person in whose name the cheque has been issued
 The person writing the cheque, known as the drawer, has a transaction banking account (often called a current, cheque, chequing or checking account) where their money is held
 The drawer writes the various details including the monetary amount, date, and a payee on the cheque, and signs it, ordering their bank, known as the drawee, to pay that person or company the amount of money stated

Cheques are a type of bill of exchange that were developed as a way to make payments without the need to carry large amounts of money
 Paper money evolved from promissory notes, another form of negotiable instrument similar to cheques in that they were originally a written order to pay the given amount to whoever had it in their possession (the ""bearer"")
"
grid paper,673637,,"Graph paper, coordinate paper, grid paper, or squared paper is writing paper that is printed with fine lines making up a regular grid
 The lines are often used as guides for plotting graphs of functions or experimental data and drawing curves
 It is commonly found in mathematics and engineering education settings and in laboratory notebooks
 Graph paper is available either as loose leaf paper or bound in notebooks



== History ==
The first commercially published ""coordinate paper"" is usually attributed to Dr
"
cup,525184,,"A cup is an open-top container used to hold liquids for pouring or drinking; it also can be used to store solids for pouring (e
g
, sugar, flour, grains)
 Cups may be made of glass, metal, china, clay, wood, stone, polystyrene, plastic, aluminium or other materials, and are usually fixed with a stem, handles, or other adornments
 Cups are used for quenching thirst across a wide range of cultures and social classes, and different styles of cups may be used for different liquids or in different situations
 Cups of different styles may be used for different types of liquids or other foodstuffs (e
g
 teacups and measuring cups), in different situations (e
g
"
tree,954896,,"In botany, a tree is a perennial plant with an elongated stem, or trunk, supporting branches and leaves in most species
 In some usages, the definition of a tree may be narrower, including only woody plants with secondary growth, plants that are usable as lumber or plants above a specified height
 In wider definitions, the taller palms, tree ferns, bananas, and bamboos are also trees
 Trees are not a taxonomic group but include a variety of plant species that have independently evolved a trunk and branches as a way to tower above other plants to compete for sunlight
 Trees tend to be long-lived, some reaching several thousand years old
"
eraser,827654,,"An eraser, (also called a rubber outside the United States, from the material first used) is an article of stationery that is used for removing marks from paper or skin (e
g
 parchment or vellum)
 Erasers have a rubbery consistency and come in a variety of shapes, sizes and colours
 Some pencils have an eraser on one end
 Less expensive erasers are made from synthetic rubber and synthetic soy-based gum, but more expensive or specialized erasers are vinyl, plastic, or gum-like materials
"
bottle cap,397148,,"A bottle cap or bottle top seals the top opening of a bottle
 A cap is typically colourfully decorated with the logo of the brand of beverage
 Plastic caps are used for plastic bottles, while metal with plastic backing is used for glass; the metal is usually steel
 Plastic caps may have a pour spout
 Flip-Top caps like Flapper closures provide controlled dispensing of dry products
"
mop,941083,,"A mop (such as a floor mop) is a mass or bundle of coarse strings or yarn, etc
, or a piece of cloth, sponge, or other absorbent material, attached to a pole or stick
 It is used to soak up liquid, for cleaning floors and other surfaces, to mop up dust, or for other cleaning purposes
 The word (then spelled mappe) is attested in English as early as 1496, but new refinements and variations of mop designs have been introduced, from time to time
 For example, American inventor Jacob Howe received U
S
 patent #241 for a mop holder in 1837 and Thomas W
 Stewart (U
S
 patent #499,402) in 1893
 The modern variant of the mop was conceived in 1956 by Manuel Jalón Corominas, finding commercial success under the branding Rodex
"
sidewalk,767916,,"A sidewalk (American English) or pavement (British English), also known as a footpath or footway, is a path along the side of a road
 It is often constructed of concrete or cement, though occasionally asphalt, and is designed for pedestrians
 A sidewalk may accommodate moderate changes in grade (height) and is normally separated from the vehicular section by a curb
 There may also be a median strip or road verge (a strip of vegetation, grass or bushes or trees or a combination of these) either between the sidewalk and the roadway or between the sidewalk and the boundary

In some places, the same term may also be used for a paved path, trail or footpath that is not next to a road, for example, a path through a park
"
glasses,376654,,"Glasses, also known as eyeglasses or spectacles, are vision aids, consisting of glass or hard plastic lenses mounted in a frame that holds them in front of a person's eyes, typically utilizing a bridge over the nose and arms which rest over the ears

Glasses are typically used for vision correction, such as with reading glasses and glasses used for nearsightedness

Safety glasses provide eye protection against flying debris for construction workers or lab technicians; these glasses may have protection for the sides of the eyes as well as in the lenses
 Some types of safety glasses are used to protect against visible and near-visible light or radiation
 Glasses are worn for eye protection in some sports, such as squash
"
canvas,89377,,"Canvas is an extremely durable plain-woven fabric used for making sails, tents, marquees, backpacks, and other items for which sturdiness is required, as well as in such fashion objects as handbags, electronic device cases, and shoes
 It is also popularly used by artists as a painting surface, typically stretched across a wooden frame
 
Modern canvas is usually made of cotton or linen, along with polyvinyl chloride (PVC), although historically it was made from hemp
 It differs from other heavy cotton fabrics, such as denim, in being plain weave rather than twill weave
 Canvas comes in two basic types: plain and duck
"
sandal,351966,,"A scandal can be broadly defined as the strong social reactions of outrage, anger, or surprise, when accusations or rumours circulate or appear for some reason, regarding a person or persons who are perceived to have transgressed in some way
 These reactions are usually noisy and may be conflicting, and they often have negative effects on the status and credibility of the person(s) or organisation involved
 Society is scandalised when it becomes aware of breaches of moral norms or legal requirements, often when these have remained undiscovered or been concealed for some time
 Such breaches have typically erupted from greed, lust or the abuse of power
 Scandals may be regarded as political, sexual, moral, literary or artistic but often spread from one realm into another
"
thermostat,387698,,"A thermostat is a component which senses the temperature of a physical system and performs actions so that the system's temperature is maintained near a desired  setpoint

Thermostats are used in any device or system that heats or cools to a setpoint temperature, examples include building heating, central heating, air conditioners, HVAC systems,  water heaters, as well as kitchen equipment including ovens and refrigerators and medical and scientific incubators
 In scientific literature, these devices are often broadly classified as thermostatically controlled loads (TCLs)
 Thermostatically controlled loads comprise roughly 50% of the overall electricity demand in the United States
A thermostat operates as a ""closed loop"" control device, as it seeks to reduce the error between the desired and measured temperatures
 Sometimes a thermostat combines both the sensing and control action elements of a controlled system, such as in an automotive thermostat
"
pants,181139,,"Plants are mainly multicellular, predominantly photosynthetic eukaryotes of the kingdom Plantae
 Historically, plants were treated as one of two kingdoms including all living things that were not animals, and all algae and fungi were treated as plants
 However, all current definitions of Plantae exclude the fungi and some algae, as well as the prokaryotes (the archaea and bacteria)
 By one definition, plants form the clade Viridiplantae (Latin name for ""green plants""), a group that includes the flowering plants, conifers and other gymnosperms, ferns and their allies, hornworts, liverworts, mosses and the green algae, but excludes the red and brown algae

Green plants obtain most of their energy from sunlight via photosynthesis by primary chloroplasts that are derived from endosymbiosis with cyanobacteria
"
radio,773108,,"Radio is the technology of signaling and communicating using radio waves
 Radio waves are electromagnetic waves of frequency between 30 hertz (Hz) and 300 gigahertz (GHz)
 They are generated by an electronic device called a transmitter connected to an antenna which radiates the waves, and received by a radio receiver connected to another antenna
 Radio is very widely used in modern technology, in radio communication, radar, radio navigation, remote control, remote sensing and other applications
 In radio communication, used in radio and television broadcasting, cell phones, two-way radios, wireless networking and satellite communication among numerous other uses, radio waves are used to carry information across space from a transmitter to a receiver, by modulating the radio signal (impressing an information signal on the radio wave by varying some aspect of the wave) in the transmitter
"
ice cube tray,479879,,"An ice cube is a small piece of ice, which is typically rectangular as viewed from above and trapezoidal as viewed from the side
 Ice cubes are products of mechanical refrigeration and are usually produced to cool beverages
 They may be produced at home in a freezer with an ice tray or in an automated ice-making accessory
 They may also be produced industrially and sold commercially



== Origin of production ==

American physician and humanitarian John Gorrie built a refrigerator in 1844 with the purpose of producing ice to cool air
"
shampoo,821005,,"Shampoo () is a hair care product, typically in the form of a viscous liquid, that is used for cleaning hair
 Less commonly, shampoo is available in bar form, like a bar of soap
 Shampoo is used by applying it to wet hair, massaging the product into the scalp, and then rinsing it out
 Some users may follow a shampooing with the use of hair conditioner

The typical reason of using shampoo is to remove the unwanted build-up of sebum in the hair without stripping out so much as to make hair unmanageable
"
floor,484082,,"A floor is the bottom surface of a room or vehicle
 Floors vary from simple dirt in a cave to many-layered surfaces made with modern technology
 Floors may be stone, wood, bamboo, metal or any other material that can support the expected load

The levels of a building are often referred to as floors, although a more proper term is storey

Floors typically consist of a subfloor for support and a floor covering used to give a good walking surface
"
boom box,223085,,"A boombox (known by names such as Jambox and ghettoblaster) is a transistorized portable music player featuring one or two cassette tape recorder/players and AM/FM radio, generally with a carrying handle
 Beginning in the mid 1980s, a CD player was often included
 Sound is delivered through an amplifier and two or more integrated loudspeakers
 A boombox is a device typically capable of receiving radio stations and playing recorded music (usually cassettes or CDs usually at a high volume)
 Many models are also capable of recording onto cassette tapes from radio and other sources
"
fork,964679,,"In cutlery or kitchenware, a fork (from the Latin furca (""pitchfork"")) is a utensil, now usually made of metal, whose long handle terminates in a head that branches into several narrow and often slightly curved tines with which one can spear foods either to hold them to cut with a knife or to lift them to the mouth
  


== History ==

Bone forks have been found in archaeological sites of the Bronze Age Qijia culture (2400–1900 BC), the Shang dynasty (c
 1600–c
 1050 BC), as well as later Chinese dynasties
 A stone carving from an Eastern Han tomb (in Ta-kua-liang, Suide County, Shaanxi) depicts three hanging two-pronged forks in a dining scene
"
drill,585030,,"A drill is a tool primarily used for making round holes or driving fasteners
  It is fitted with a bit, either a drill or driver, depending on application, secured by a chuck
 Some powered drills also include a hammer function

Drills vary widely in speed, power, and size
  They are characteristically corded electrically driven devices, with hand operated types dramatically decreasing in popularity and cordless battery powered ones proliferating
"
helmet,847133,,"A helmet is a form of protective gear worn to protect the head
 More specifically, a helmet complements the skull in protecting the human brain
 Ceremonial or symbolic helmets (e
g
 UK policeman's helmet) without protective function are sometimes worn
 Soldiers wear helmets, often made from lightweight plastic materials
"
bow and arrow,189031,,"The bow and arrow is a ranged weapon system consisting of an elastic launching device (bow) and long-shafted projectiles (arrows)

Archery is the art, practice, or skill of using bows to shoot arrows
 A person who shoots arrows with a bow is called a bowman or an archer
 Someone who makes bows is known as a bowyer, one who makes arrows is a fletcher, and one who manufactures metal arrowheads is an arrowsmith
Humans used bows and arrows for hunting and violence long before recorded history and was common to many prehistoric cultures
 They were important weapons of war from ancient history until the early modern period, where they were rendered increasingly obsolete by the development of the more powerful and accurate firearms, and were eventually dropped from warfare
"
remote control,735393,,"In electronics, a remote control or clicker is an electronic device used to operate another device from a distance, usually wirelessly
 For example, in consumer electronics, a remote control can be used to operate devices such as a television set, DVD player or other home appliance, from a short distance
 A remote control is primarily a convenience feature for the user, and can allow operation of devices that are out of convenient reach for direct operation of controls
 In some cases, remote controls allow a person to operate a device that they otherwise would not be able to reach, as when a garage door opener is triggered from outside or when a Digital Light Processing projector that is mounted on a high ceiling is controlled by a person from the floor level

Early television remote controls (1956–1977) used ultrasonic tones
"
chapter book,335265,,"A chapter book or chapterbook is a story book intended for intermediate readers, generally age 7–10
  Unlike picture books for beginning readers, a chapter book tells the story primarily through prose, rather than pictures
  Unlike books for advanced readers, chapter books contain plentiful illustrations
  The name refers to the fact that the stories are usually divided into short chapters, which provide readers with opportunities to stop and resume reading if their attention spans are not long enough to finish the book in one sitting
  Chapter books are usually works of fiction of moderate length and complexity
"
balloon,862246,,"A balloon is a flexible bag that can be inflated with a gas, such as helium, hydrogen, nitrous oxide, oxygen, air
 For special tasks, balloons can be filled with smoke, liquid water, granular media (e
g
 sand, flour or rice), or light sources
 Modern day balloons are made from materials such as rubber, latex, polychloroprene, or a nylon fabric, and can come in many different colors
 Some early balloons were made of dried animal bladders, such as the pig bladder
"
shoes,135313,,"A shoe is an item of footwear intended to protect and comfort the human foot
 Shoes are also used as an item of decoration and fashion
 The design of shoes has varied enormously through time and from culture to culture, with appearance originally being tied to function
 Additionally, fashion has often dictated many design elements, such as whether shoes have very high heels or flat ones
 Contemporary footwear in the 2010s varies widely in style, complexity and cost
"
sponge,439015,,"Sponges, the members of the phylum Porifera (; meaning ""pore bearer""), are a basal Metazoa (animal) clade as a sister of the Diploblasts
 They are multicellular organisms that have bodies full of pores and channels allowing water to circulate through them, consisting of jelly-like mesohyl sandwiched between two thin layers of cells
 The branch of zoology that studies sponges is known as spongiology

Sponges have unspecialized cells that can transform into other types and that often migrate between the main cell layers and the mesohyl in the process
 Sponges do not have nervous, digestive or circulatory systems
"
screw,423687,,"A screw is a type of fastener, in some ways similar to a bolt (see Differentiation between bolt and screw below), typically made of metal, and characterized by a helical ridge, known as a male thread (external thread)
 Screws are used to fasten materials by digging in and wedging into a material when turned, while the thread cuts grooves in the fastened material that may help pull fastened materials together and  prevent pull-out
 There are many screws for a variety of materials; those commonly fastened by screws include wood, sheet metal, and plastic



== Explanation ==
A screw is a combination of simple machines—it is in essence an inclined plane wrapped around a central shaft, but the inclined plane (thread) also comes to a sharp edge around the outside, which acts a wedge as it pushes into the fastened material, and the shaft and helix also form a wedge in the form of the point
 Some screw threads are designed to mate with a complementary thread, known as a female thread (internal thread), often in the form of a nut, or object that has the internal thread formed into it
"
desk,53339,,"A desk or bureau is a piece of furniture with a flat table-style work surface used in a school, office, home or the like for academic, professional or domestic activities such as reading, writing, or using equipment such as a computer
 Desks often have one or more drawers, compartments, or pigeonholes to store items such as office supplies and papers
 Desks are usually made of wood or metal, although materials such as glass are sometimes seen

Some desks have the form of a table, although usually only one side of a desk is suitable to sit at (there are some exceptions, such as a partners desk), unlike most usual tables
 Some desks do not have the form of a table, for instance, an armoire desk is a desk built within a large wardrobe-like cabinet, and a portable desk is light enough to be placed on a person's lap
"
ring,686872,,"A wing is a type of fin that produces lift, while moving through air or some other fluid
 As such, wings have streamlined cross-sections that are subject to aerodynamic forces and act as airfoils
 A wing's aerodynamic efficiency is expressed as its lift-to-drag ratio
 The lift a wing generates at a given speed and angle of attack can be one to two orders of magnitude greater than the total drag on the wing
 A high lift-to-drag ratio requires a significantly smaller thrust to propel the wings through the air at sufficient lift
"
greeting card,179174,,"A greeting card is an illustrated piece of card stock or high quality paper featuring an expression of friendship or other sentiment
 Although greeting cards are usually given on special occasions such as birthdays, Christmas or other holidays, such as Halloween,  they are also sent to convey thanks or express other feelings (such as to get well from illness)
 Greeting cards, usually packaged with an envelope, come in a variety of styles
  There are both mass-produced as well as handmade versions that are distributed by hundreds of companies large and small
 While typically inexpensive, more elaborate cards with die-cuts or glued-on decorations may be more expensive
"
washing machine,963672,,"A  washing machine (laundry machine, clothes washer, or washer) is a home appliance used to wash laundry
 The term is mostly applied to machines that use water as opposed to dry cleaning (which uses alternative cleaning fluids, and is performed by specialist businesses) or ultrasonic cleaners
 The user adds laundry detergent, which is sold in liquid or powder form, to the wash water



== Washing by hand ==

Laundering by hand involves soaking, beating, scrubbing, and rinsing dirty textiles
 Before indoor plumbing, the maids, washerwoman (laundress), or housewife also had to carry all the water used for washing, boiling, and rinsing the laundry; according to an 1886 calculation, some women in the United States fetched water eight to ten times every day from a pump, well, or spring for these purposes
"
box,804415,,"Box (plural: boxes) describes a variety of containers and receptacles for permanent use as storage, or for temporary use, often for transporting contents

Boxes may be made of durable materials such as wood or metal, or of corrugated fiberboard, paperboard, or other non-durable materials
 The size may vary from very small (e
g
, a matchbox) to the size of a large appliance
 A corrugated box is a very common shipping container
  When no specific shape is described, a box of rectangular cross-section with all sides flat may be expected, but a box may have a horizontal cross section that is square, elongated, round or oval; sloped or domed top surfaces, or vertical edges
"
tire swing,687872,,"A swing is a hanging seat, often found at playgrounds for children, at a circus for acrobats, or on a porch for relaxing, although they may also be items of indoor furniture, such as the Latin American hammock or the Indian oonjal
 The seat of a swing may be suspended from chains or ropes
 Once a swing is in motion, it continues to oscillate like a pendulum until external interference or drag brings it to a halt
 Swing sets are very popular with children

On playgrounds, several swings are often suspended from the same metal or wooden frame, known as a swing set, allowing more than one child to play at a time
"
